832573	what is the methylmalon a. c test
1107821	what was radio free europe?
1113361	what is prior restraint?
364210	how to help a jammed finger
935964	when are whales most active for whale watching in massachusetts
935353	when and where did the battle of manassas take place
681645	what is a divorce bench trial
952284	when is the best time to fish with a crawfish color bait
818583	what is the difference between the range rover and the range rover sport
226975	how does my baby get submitted for medicaid after birth
237669	how is the oil pollution act of 1990 effect oil companies
764738	what is lbm in body composition
2002269	how fast does a rabbit grow
2005810	what are the entities of the executive branch
2006627	what is 311 for
2007419	what is cold bridging
2032090	what to do if your partner is possessive?
2032956	how much was the saturn v
2033232	people who have fled the us because trump
2035447	how much money do i need in bangkok
2037251	how many people watch nba basketball
2037924	what can you do with heart of palm
2040613	what does london breed stand for
2049687	what vaccination should u give show piglets
